Time,User,Message
0.0,36977260e48f79080c010b835011b373252197d7,it works for talents 
1.0,c049d60bb5837b7b6cd75499a18bc8f94c893dc4,you need to do a return after the #show d69b0c2ca1860a9d5b790ad4077b67aecc031a0d 
5.0,36977260e48f79080c010b835011b373252197d7,for pvp talents they don't work 
12.0,2e4fea28ee5a5d1d6d4b4e9f94c73d345b78e3ff,oh word 
25.0,2e4fea28ee5a5d1d6d4b4e9f94c73d345b78e3ff,yeah i was trying to demon/nether armor on my lock and spent about 4 hours beating my head against the wall 
29.0,2e4fea28ee5a5d1d6d4b4e9f94c73d345b78e3ff,before realizing its broke 
43.0,36977260e48f79080c010b835011b373252197d7,no more tiers in pvp they've yet to update the pvp talent listing 
62.0,e72910e596f71040955036a86578306092988ada,anyone have a clue on classic wow beta dates 
68.0,2e4fea28ee5a5d1d6d4b4e9f94c73d345b78e3ff,all they would need to add is the prefix [pvptalent: #/#] 
76.0,c049d60bb5837b7b6cd75499a18bc8f94c893dc4,e72910e596f71040955036a86578306092988ada soon kappa 
84.0,36977260e48f79080c010b835011b373252197d7,as in [pvptalent:n] where n would be the number of the pvp talent in the list from top to bottom 
90.0,e72910e596f71040955036a86578306092988ada,c049d60bb5837b7b6cd75499a18bc8f94c893dc4 sigh biblethump 
117.0,5bd5dd73a36da7ee96893ed5693a8b7b3e7870dd,wait what arc mage and arms warr lol u cant lose this xd 
155.0,7915a5d1a70be15bde6354023421385f3b8a426f,arc mage is good dont underestimate it 
156.0,2e4fea28ee5a5d1d6d4b4e9f94c73d345b78e3ff,itd be [pvptalent:x/y] where x is the position top to bottom and y is the talent in the talent list right 
167.0,5bd5dd73a36da7ee96893ed5693a8b7b3e7870dd,7915a5d1a70be15bde6354023421385f3b8a426f it is but not with an arms warrior 
203.0,5bd5dd73a36da7ee96893ed5693a8b7b3e7870dd,2e4fea28ee5a5d1d6d4b4e9f94c73d345b78e3ff what u saying xd 
238.0,5bd5dd73a36da7ee96893ed5693a8b7b3e7870dd,imagine losing form a arms warrior xd 
244.0,13d4933b9e3b60dab504924886fafdf728c5ea2f,guys what addon does he use to show the effects in the portrait wnidow 
287.0,c049d60bb5837b7b6cd75499a18bc8f94c893dc4,you need to hit return after the #show in the macro d69b0c2ca1860a9d5b790ad4077b67aecc031a0d 
293.0,5bd5dd73a36da7ee96893ed5693a8b7b3e7870dd,lul lul lul lul lul lul lul lul lul lul 
294.0,7915a5d1a70be15bde6354023421385f3b8a426f,big debuffs i think could also just be a defualt setting 
301.0,47f7cffc71a0002ac670885b52153be5f73dd2d1,could you of casted heals on mage at the end 
306.0,28770324f1abb23bc58396fd8bbc4284206970ef,better play lock 
308.0,656bf556dfed91922c16d6b2521c91242e5c69c9,full mooon 
342.0,7915a5d1a70be15bde6354023421385f3b8a426f,i love the full moon talent tbh 
354.0,7915a5d1a70be15bde6354023421385f3b8a426f,shit looks sick n does good dam 
358.0,47f7cffc71a0002ac670885b52153be5f73dd2d1,full moon does like no dmg 
369.0,47f7cffc71a0002ac670885b52153be5f73dd2d1,atleast not like it did last xpac 
373.0,7a66b76340fc4c9dc1fd978d2793ee86a4b07cf5,yeah not good 
376.0,375a6059c0240a39d61eb0e4f784ec34c2558cf0,its less dmg overall but burst potential 
390.0,ead08a237f9f8953039dec79b07d37e55f674ff2,full moon his like a truck and you get a free starsurge in afterwards 
392.0,7a66b76340fc4c9dc1fd978d2793ee86a4b07cf5,warrior of elune is honestly better if you want burst 
394.0,01eab0e420a7282eccb437ef87f37ab8ce9306de,please go warlock 
398.0,ead08a237f9f8953039dec79b07d37e55f674ff2,its insane burst if theyre training mage like that last game 
410.0,c049d60bb5837b7b6cd75499a18bc8f94c893dc4,yes it does d69b0c2ca1860a9d5b790ad4077b67aecc031a0d 
417.0,c049d60bb5837b7b6cd75499a18bc8f94c893dc4,try it 
423.0,455d76957eac943d40098d2b42987e6d008e8509,full moon does slap it also has the intimidation factor where it will eat kicks and you can still clone or vise verse 
425.0,ead08a237f9f8953039dec79b07d37e55f674ff2,do you want my mouseover talent change macros 
433.0,02454c926513b9baf0871da9b3db45f48cbb3963,where is everyone getting this info that beta is coming out tmrw who said it 
437.0,02454c926513b9baf0871da9b3db45f48cbb3963,i dont see a blue post 
440.0,ead08a237f9f8953039dec79b07d37e55f674ff2,i got a similar one but its all on mouseovers as well 
451.0,c049d60bb5837b7b6cd75499a18bc8f94c893dc4,yes 
457.0,c049d60bb5837b7b6cd75499a18bc8f94c893dc4,target bash focus roots 
484.0,bf17e110419118080cb96778cbb4961d13a67731,what happened 
493.0,e03efd9fcbde63e3eeab4347c181e9a525b53e2c,how is ret paladins 
504.0,c049d60bb5837b7b6cd75499a18bc8f94c893dc4,you already loved my curses macro in legion that i made for you :d 
504.0,bf17e110419118080cb96778cbb4961d13a67731,oh cdew 
508.0,7915a5d1a70be15bde6354023421385f3b8a426f,02454c926513b9baf0871da9b3db45f48cbb3963 people are just throwin shit in the ajr lol 
509.0,bf17e110419118080cb96778cbb4961d13a67731,hes a twat 
516.0,5a881946f2e099dcef27074f1bbcc7bbac181854,re druid 
517.0,02454c926513b9baf0871da9b3db45f48cbb3963,but everyone is saying it 
520.0,02454c926513b9baf0871da9b3db45f48cbb3963,where did it come from 
523.0,02454c926513b9baf0871da9b3db45f48cbb3963,who said something first 
525.0,84bb5b7bca5dd45da893750def93a2f38ddba026,such a good weapon 
529.0,c049d60bb5837b7b6cd75499a18bc8f94c893dc4,now try focus mass rtoots 
540.0,7915a5d1a70be15bde6354023421385f3b8a426f,idek 
542.0,02454c926513b9baf0871da9b3db45f48cbb3963,says who where is this leak 
548.0,02454c926513b9baf0871da9b3db45f48cbb3963,i cant find it 
560.0,4b1c638969f2f42fe399e1ad95df2e532be522c3,d69b0c2ca1860a9d5b790ad4077b67aecc031a0d i heard it's pretty limited beta tho 
562.0,4b1c638969f2f42fe399e1ad95df2e532be522c3,i 
581.0,02454c926513b9baf0871da9b3db45f48cbb3963,i dont want a beta 
583.0,02454c926513b9baf0871da9b3db45f48cbb3963,dont play the beta 
583.0,4b1c638969f2f42fe399e1ad95df2e532be522c3,that's a feelsbadman for most of us 
587.0,2ff3fd868fa6c0c77de15dc9327db8e721486f45,do you think method black trhew against abc btw you can change talent there if you go pixel on pixel on the hearthstone 
587.0,02454c926513b9baf0871da9b3db45f48cbb3963,enjoy the launch 
590.0,a6ca1110f962802b37887ad506117fea4a2ee560,are you gonna play warlock at classic 
593.0,5bd5dd73a36da7ee96893ed5693a8b7b3e7870dd,lol metaphorfs trash talking cdew now they only won blizcon last year because of trait buggs he is one jelly muddafuckaa xd 
595.0,7915a5d1a70be15bde6354023421385f3b8a426f,wouldnt be surprised if it was just like the demo 
611.0,84bb5b7bca5dd45da893750def93a2f38ddba026,#maldivegoferal 
615.0,2ff3fd868fa6c0c77de15dc9327db8e721486f45,there is an inkeeper there 
620.0,ea789ab93e4819427959beb79337a5433b8c0565,what trait buggs 
620.0,375a6059c0240a39d61eb0e4f784ec34c2558cf0,dont hate the player hate the game 
624.0,02454c926513b9baf0871da9b3db45f48cbb3963,thats what an employee alpha can do 
628.0,4b1c638969f2f42fe399e1ad95df2e532be522c3,d69b0c2ca1860a9d5b790ad4077b67aecc031a0d if i type up a list of shit for u to test for me wld u do it :d 
632.0,44385d797847d1c36f644a7856bcc25401fc4560,why u playing with meta again 
637.0,c049d60bb5837b7b6cd75499a18bc8f94c893dc4,writing macros is really simple once you're looked into it 
640.0,02454c926513b9baf0871da9b3db45f48cbb3963,they already have the code 
643.0,02454c926513b9baf0871da9b3db45f48cbb3963,its not a new ip 
648.0,5a881946f2e099dcef27074f1bbcc7bbac181854,#maldivagoaffliction 
655.0,84bb5b7bca5dd45da893750def93a2f38ddba026,just go feral and queues will be instant 
662.0,4b1c638969f2f42fe399e1ad95df2e532be522c3,like how certain mechanics work like spell que etc d69b0c2ca1860a9d5b790ad4077b67aecc031a0d 
671.0,077c2ecb99e22497d9c71b52ab26da6dd23d0580,blizz testers arent good enough at the game to find all the bugs lol j/k 
678.0,a6ca1110f962802b37887ad506117fea4a2ee560,which professions do you take on wl in classic 
693.0,bafc948cf89df46b31f0ce39bfeb94a79e040125,i've been out of the loop but what's the news regarding classic this week 
713.0,7915a5d1a70be15bde6354023421385f3b8a426f,i think they used legions base no diff tho really 
725.0,ead08a237f9f8953039dec79b07d37e55f674ff2,:o a demo 
748.0,7915a5d1a70be15bde6354023421385f3b8a426f,this demo bouta /flex on maldiva for playing destro 
751.0,f2ff08aab09ec02eb1ec07ad3a00d95191f139cc,im hoping the server stablilty will be better than vanilla though lol 
771.0,ead08a237f9f8953039dec79b07d37e55f674ff2,lsd dream died with thalkiels 
835.0,7915a5d1a70be15bde6354023421385f3b8a426f,the servers in bfa arent even as good as vanilla 
917.0,c049d60bb5837b7b6cd75499a18bc8f94c893dc4,one <is the loneliest number> actually a nice name/guild duo lul 
